emotion,video_id,author,comment
buồn,URptIvqwA6w,@matgaming3742,27 9 mình mất tất cả công ăn việc làm người từng nói yêu thương cũng bỏ mình mà đi thật sự muốn tự giải thỡát cho bản mình khỏi cõi đời này thực sự không biết bắt đầu từ đâu nữa
buồn,URptIvqwA6w,@ThuanTrinh-wg3xf,mô phật
buồn,URptIvqwA6w,@nangtran-u7m,thực sự mệt mỏi sài lầm cứ tiếp điễn nợ nần vây quanh bỏ bê công việc còn xin quận thế âm bồ tát sôi đg chỉ lối cho còn động lực vượt qua nghịch cảnh này còn sài rồi
buồn,URptIvqwA6w,@nangtran-u7m,thực sự mệt mỏi sài lầm cứ tiếp điễn nợ nần vây quanh bỏ bê công việc còn xin quận thế âm bồ tát sôi đg chỉ lối cho còn động lực vượt qua nghịch cảnh này còn sài rồi
buồn,URptIvqwA6w,@nangtran-u7m,thực sự mệt mỏi sài lầm cứ tiếp điễn nợ nần vây quanh bỏ bê công việc còn xin quận thế âm bồ tát sôi đg chỉ lối cho còn động lực vượt qua nghịch cảnh này còn sài rồi
buồn,URptIvqwA6w,@WINAOFFICIAL93,lúc này chỉ muốn được nghệ những lời an ủi này thật sự lúc nào cũng bế tắc và mệt mỏi như thế này thời điểm này thật tồi tệ
buồn,URptIvqwA6w,@giaitrimoingay9172,8 2024 nợ 600tr đàng rơi vào trong bế tắc và cố dặn bản thân mình phải cố gắn từng ngày
buồn,URptIvqwA6w,@tranquilwisdom8,trong những thời điểm khó khăn điều quan trọng là phải tiếp tục tiến lên dù gặp phải trở ngại giống như các vật thể phản ứng khác nhau với nước sôi chúng ta cũng cần phải thích nghi và tiếp tục tiến về phía trước thay vì rơi vào tuyệt vọng
buồn,URptIvqwA6w,@phungvusy,gia đình là tất cả
buồn,URptIvqwA6w,@VanGiangNguyen-m8r,tôi nợ 200tr đã gắng hết sức vì gia đình nhưng đến phút cuối mới nhận ra rằng vợ mình xem mình có cũng như không cảm giác chán trường ai hiểu được tôi không nam mô bổn sư thích ca mâu ni phật che chở cho con qua nổi đau này
buồn,URptIvqwA6w,@NgaNguyễn-u4f,cầu phát trời phú họ cho cơn
buồn,URptIvqwA6w,@Abcd-d7p4f,nhà cửa đường xá quy hoạch đẹp quá đúng là đất nước của những giấc mơ
buồn,URptIvqwA6w,@phucvo5418,đúng là họa vô đơn chí công tỷ đàng hoạt động bình thường từ đâu coviđ ập đến công tỷ phá sản bị thất nghiệp ở tuổi 50 đi xin việc như hái sao trên trời cưộc sống bế tắc mình như là tội đồ người thân anh em ruột thịt xã lánh vợ bỏ đi bạn bè xã lánh tội nghiệp 2 đứa nhỏ sống trong bất an có chăng đây là nghiệp chướng không biết có ai gặp hoàn cảnh như thế này không mình đau quá muốn chia sẽ chứ không lợi đụng lòng thương hại của anh em đâu nghỉ cưộc đời nó bạc thật
buồn,URptIvqwA6w,@HaNguyen-pg7dj,tôi cũng bế tắc
buồn,URptIvqwA6w,@phungly7972,hiện tại tôi đang lâm vào đưingf cùng vì làm ăn thừa lõi và bị lừa tôi chưa bao h thấy bế tắc như này tôi chỉ mong có thể biến mất khỏi cưộc đời này ngay bây gìờ
buồn,URptIvqwA6w,@六老-f9y,năm mô á đi đã phát các bán hải niềm nam mở đại từ dài bị cử kho cũ nạn quận thể âm bộ tát
buồn,URptIvqwA6w,@ManhNguyen-vl9mk,9 8 2024cuộc sống em tuyệt vọng quá làm ăn bết bát đổ vỡ nợ nần chồng chất muốn kết thúc cưộc đời mình quá em không dám ngủ vì đến ngày mai em lại không biết phải làm gì để vượt qua khó khăn rồi ngày kia ngày kìa nữa còn xin lỗi bố mẹ
buồn,URptIvqwA6w,@ChungLe-ur4mv,bế tắc của tận cùng tôi phải làm sao đây nhiều lúc tôi muốn kết thúc cưộc đời này
buồn,URptIvqwA6w,@vanlocnguyen6218,chưa bao giờ bế tắc và nợ nần hết đường gỡ ra như thế này 08 08 2024 thật là tồi tệ
buồn,URptIvqwA6w,@yeumaivangbonsai4724,quý hợi chưa bao giờ ổn cả nợ nần ngập đầu đêm đến chưa bao giờ chợp mắt thật sự bế tắt không biết lối thoát nào dành cho mình lúc này 2 đứa con thơ sẽ ra sao đời chẳng bao giờ bằng phẳng đối với mình
buồn,URptIvqwA6w,@HoaLe-u7k,cậu chuyện người bố bỏ đi vì mẹ quá quắt kg biết quan tâm chia sẻ vói chồng sao giống hoàn cảnh nhà tôi quá vậy người phụ nữ này giống hệt tính cách mẹ tôi nhiều lúc con cái cũng cảm thây chán nản ngán ngẩm
buồn,URptIvqwA6w,@NguyetNgoc-m2u,nhiều lúc suy nghĩ không biết cách nào để thoát ra khỏi nợ nần chồng chất ra đời thì không ai coi mình ra gì buồn lắm nhiều lúc muốn chết đi cho khỏe nhưng lại nghĩ đến những người yêu thì lại cố gắng nhưng lại tuyệt vọng
buồn,URptIvqwA6w,@kimtuyenle214,chưa bao giờ có cảm giác tuyệt vọng như lúc này
buồn,URptIvqwA6w,@tuongvu3185,áp lực qúá
buồn,URptIvqwA6w,@covlog6628,nghệ tôi càng thấm bởi nghệ trong câu truyện tôi thấy có cảm giác của bố tôi hồi đó và tôi bây giờ ai trong hoàn cảnh thì cố gắng nhé lời tôi cũng tự động viên mình cố lên nhé tôi ơi
buồn,URptIvqwA6w,@Tulku-vn,đúng vậy
buồn,URptIvqwA6w,@ĐiệpKiều-j5n,bún 1 mình từ vường
buồn,URptIvqwA6w,@Starlove_LinhHuongVoThu2008,tôi cũng đang tuyệt vọng không biết phải làm thế nàô
buồn,URptIvqwA6w,@hingping1979,cảm ơn bạn chia sẻ
buồn,URptIvqwA6w,@BaNguyễnVăn-e9p,thật sự là rất buồn chẳng biết làm sao tương không còn lối thoát còn xin địa tạng bồ tát cứu còn với còn nằm mở á đi đà phật
buồn,URptIvqwA6w,@ThanhtaiNguyen-b8v,ngày 13 7 2024 mong mọi chuyên sẽ vượt qua tất cà
buồn,URptIvqwA6w,@HanhHoang-yj5fo,quá bãi việt về người bộ người bộ có 1 người bán thất tiyết với và tôi cùng có 1 người bán như vậy hơn cả người chống của tới và 2 đưa tới không ai thay đổi vệ tình nét và chính vì điều độ mới khi tới lên con đồng kính và giang chính lã người tuyệt vời mhat
buồn,URptIvqwA6w,@HanhHoang-yj5fo,đã làm bộ mê thì bố mẹ hy sinh chờ còn vờ điều kiện bố mê là mặt trang và mặt trời cho còn của mình nhìn vào tầm giống sang cuab mẹ mình bơi vì bộ mễ cho cho dự bộ mê mình có bị đô thị vấn là người tuyệt vời nhất đội với tôi cảm ơn chương trình cobaiviet rất hay tuyết
buồn,1OPvFfjwfrU,@ANLAC26,câm mõm
buồn,1OPvFfjwfrU,@PhuocNguyen-xw3zm,kênh vô đạo đức này tồn tại
buồn,1OPvFfjwfrU,@HuyenNguyen-yj7ts,lạc đề treo đầ đê
buồn,1OPvFfjwfrU,@hanvuthanh2950,tôi muốn hỏi lại văn sâm chứ đâu hỏi ông bạch mà nói lạc đề vậy
buồn,1OPvFfjwfrU,@khanhdo9117,mẹ tiêu để một đường nội dùng một nẻô
buồn,1OPvFfjwfrU,@SơnLương-p5n,có thập không vậy hay chỉ là lời đồn
buồn,1OPvFfjwfrU,@LợiNguyễnngọc-q1k,người ta hỏi lại văn sâm mà nói toàn là thành bạch không hà
buồn,1OPvFfjwfrU,@annienguyen1409,cầu viiew rồi 1
buồn,1OPvFfjwfrU,@thanhtran8878,sâm chết ai cũng nừng sâm đa dâm qúá
buồn,1OPvFfjwfrU,@NgâtỏaLêVạnNgân,thất đức qúá
buồn,1OPvFfjwfrU,@nguyencongminh404,hiênn này mc lại văn sâm chết chưa
buồn,1OPvFfjwfrU,@angchauanh6249,ỷoutube không phải là nơi làm nội đúng không đúng sự thật
buồn,1OPvFfjwfrU,@Nguyễn_Đình_Thi_86,bọn thất đức
buồn,1OPvFfjwfrU,@nguyeninh8237,kênh như đb vày
buồn,1OPvFfjwfrU,@parkjenayoung175,thất đức
buồn,1OPvFfjwfrU,@duongnguyenphuc3601,làm content như này nghỉ đi là vừa
buồn,gwceU2tbej8,@ThanhDo-qh3nt,khuyên mọi người từ nay không lên xem kênh này nữa mất hết uy tín và lòng tin rồi tự đăng kênh và tự xem thôi nha
buồn,gwceU2tbej8,@ThanhDo-qh3nt,mạng xh sinh ra để nói những điều tốt đẹp hữu ích cho cộng đồng chứ không phải để những người vô ích nói bừa nói gì cũng được đâu nha yêu cầu nhà nước hãy sử nghiêm đối với những phần tử xấu để xh mãi mãi được bình an hạnh phúc
buồn,gwceU2tbej8,@KhaiLevan-pn4yh,nên đóng kênh này vĩnh viễn đi
buồn,gwceU2tbej8,@KhaiLevan-pn4yh,mọi người không bao giờ coi kẻnh này người ta còn sống má nó dám đăng người ta chết
buồn,gwceU2tbej8,@HoàiKhàthị-d1r,mồm lên da non à mà nói điêu vậy
buồn,gwceU2tbej8,@MộcNguyễnVăn-e6x,tỉn vô vàn
buồn,gwceU2tbej8,@KimPhượngĐỗ-f9h,có không vậy trời
buồn,gwceU2tbej8,@FnRrn-p9f,sao giờ nhiều người ở không rảnh rỗi thế nhỉ
buồn,gwceU2tbej8,@SơnNguyễn-d5c7s,bọn cali chuẩn bị ăn cam ý
buồn,gwceU2tbej8,@yhuynh587,mẹ cha mày để tin 1 nơi rồi nói 1 ngã
buồn,gwceU2tbej8,@DiygRhn,tao lào
buồn,gwceU2tbej8,@ThamLe-of8ms,tào lào
buồn,gwceU2tbej8,@giakhanhnguyeninh71,bro nghĩ bro giỏi lắm cơdamn tin fake
buồn,gwceU2tbej8,@thanhtran8878,mừng quá sâm bất tài bết đức đã chầu trời
buồn,gwceU2tbej8,@mocmien1977,tổ sư đứa nào làm lên video này mày rồi quả báo đến sớm thôi
buồn,gwceU2tbej8,@ThaoTran-h9o,yêu cầu kênh nói cho chuẩn không bao giờ xem
buồn,gwceU2tbej8,@minhtrungtran3976,sao không xóa sổ kênh sl này đi
buồn,gwceU2tbej8,@LaiHuỳnh-s4z,bò tót
buồn,gwceU2tbej8,@hihwshsjbf8328,kênh luyên thuyên này mà cũng cho hoạt động
buồn,gwceU2tbej8,@YDinh-p7s,quân bốc fét
buồn,gwceU2tbej8,@YDinh-p7s,bác sâm cũng chết nhưng chắc nhiều năm nữa
buồn,gwceU2tbej8,@iVuiNam,chúng mày nói như các
buồn,gwceU2tbej8,@ana3nguyenanninh,không có nhà 5 tháng trước túi cỏi youtube của mc khánh vy chú còn quay mà coi ròi bt nhà
buồn,gwceU2tbej8,@autumn_sunnyy,bóc phết
buồn,gwceU2tbej8,@chinchunngo-mf5lv,mọi người đừng tỉn
buồn,gwceU2tbej8,@chinchunngo-mf5lv,phét ít thôi
buồn,gwceU2tbej8,@TungNguyen-rx2bh,ác vừa thôi
buồn,gwceU2tbej8,@LamNguyen-lv8bh,xin chia buồn cùng gia đình anh
buồn,gwceU2tbej8,@lecat3029,ác vừa thôi
buồn,gwceU2tbej8,@leminhduy9245,báổ chó người ta còn sống sờ sờ mà đăng vớ vẩn địt mẹ bọn vớ vẩn
buồn,gwceU2tbej8,@hachau3647,tín việt nam này chuyên trù người ta chết
buồn,f9hb2ovj4Tk,@trietlytinhhoa,tiết lộ lời trăn trối cuối cùng của trương mỹ lan trước khi lãnh án t ử triết lý tinh hoa
buồn,f9hb2ovj4Tk,@mikenguyen909,tàổ lao nói thì hay lắm lấy like thì cũng phải có logíc chứ
buồn,f9hb2ovj4Tk,@VũHuỳnh-y1i,theo tôi là không nêntử hình việt nam có một ở 2
buồn,f9hb2ovj4Tk,@jokernguyen6175,đừng dẫn dắt dư luận nghiệp báo cũng lãnh đủ đấy triết lý nhân sinh gì ở đây
buồn,f9hb2ovj4Tk,@ThuNguyen-bx3od,tàổ lao tứ đế trương mỹ lan đã được trắng án về nhà rồi chứ có bị giết đâu
buồn,f9hb2ovj4Tk,@HoangAnh-kv3kr,bữa cơm đau
buồn,f9hb2ovj4Tk,@VŨHUNG-k9e,cầu cho mọi người luôn bình an
buồn,f9hb2ovj4Tk,@sentran6781,ok chương trình rất hay người nói có giống nói qua hay và làm cho người nghe nhiều xúc dong
buồn,f9hb2ovj4Tk,@tuvo2191,ước gì không ai bị tử hình
buồn,f9hb2ovj4Tk,@LýNguyễnThị-c8w,ngày cũng chỉ an hai bữa cơm sao mà lại ngũ thế nhỉ không biết đu
buồn,f9hb2ovj4Tk,@tuanlam7151,hại biết bao người chết chưa hết tội
buồn,f9hb2ovj4Tk,@ThiệnNguyễn-p5d,năm mô anh đi đà phật nhân quả không chưa một ai
buồn,f9hb2ovj4Tk,@SỹHồngHồ-f6d,nghệ chỉ miếng tôi phẩm miếng phát tâm xa
buồn,f9hb2ovj4Tk,@duongtriy5572,kẻ nào cũng thế khi sống đạp lên trên tất cả dẫm đập lên người dân đau khổ khi lĩnh án thì kể nể công lao kể hoàn cảnh không nghe kẻ bất lương sám hối
buồn,f9hb2ovj4Tk,@ThúyTrươngThị-l2r,chết như thế nào thì cũng là chết muon van cái chết mà chết là hết song tốt cũng chết song tôi tu cũng là chết nhg chết mà để lại cho con cái rất rất nhiều nhiều tỷ thì cũng đáng chết còn tôi chết chả để lại cho con cái gì tốt để làm gì khi chết chỉ có hai bàn tay trắng
buồn,f9hb2ovj4Tk,@TuấnQuốc-c4s,kênh này luôn nói tâm bây biết rõ thì nói không biết thì im lặng nói bậy để câu lấy ạ
buồn,f9hb2ovj4Tk,@anhlinh6831,triết lý tính hoa mà ra thông tin như ăn cướp
buồn,f9hb2ovj4Tk,@HienNguyen-wx7zi,nhiều tiền để làm gì
buồn,f9hb2ovj4Tk,@HangNguyen-kw8gy,còn mọt còn sâu làm sao phải đau sót ăn cho lắm đục khoét cho nhiều kẻ làm suy tàn kinh tế của nhà nước tội này tử hình là đúng phải như thế mới làm gương cho những kẻ muốn làm sâu mọt muốn đục khoét tiền của tài sản của nhà nước việt nam
buồn,f9hb2ovj4Tk,@ongnha6555,năm mô anh đi đà phật nam mô anh đi đà phật nam mô anh đi đà phật
buồn,f9hb2ovj4Tk,@nutran997,lòng tham không đáy dẫn dắt cho hành động biết bao người gia đình đã khổ vì lòng tham của bà
buồn,f9hb2ovj4Tk,@NguyetTran-kl3ko,ngày trước nhìn gương mặt đẹp rạng ngời ai cũng mơ ước tiền nhiều để làm gì sung xướng trên mồ hôi nước mắt của biêys bao người dân nghèo khổ tòa án lương tâm cán cân công lí sử cho đúng người đúng tội đằng nào cũng chết chết sớm đỡ nhục
buồn,f9hb2ovj4Tk,@NhuầnNguyễn-e3n,lúc hút máu của dân thì không ân hận
buồn,f9hb2ovj4Tk,@Kiet95Truong,đáng đời
buồn,f9hb2ovj4Tk,@tuanlehaiduong2006,thời gian kéo dài nhận án tử sống còn khổ hơn chết tỉnh thần dằn vặt không chịu nổi thôi thì cũng hết một kiếp người tấm gương tử hình như vậy mà rất nhiều người lao vào những người người đư ăn đư mặc những người có ăn học những người có địa vị xã hội thật đáng bưồn
buồn,f9hb2ovj4Tk,@davidtank9057,có thể làm mà thậm tiền nhiều chết cũng có mang i ược đầu phật nói những kẻ tham ăn bớt ăn trặn không trước thì sau
buồn,f9hb2ovj4Tk,@chaudo2645,làm nhân bà lập
buồn,f9hb2ovj4Tk,@MocNguyen-vu1xc,chuyện còn dài dài lắm luyên thuyên
buồn,f9hb2ovj4Tk,@KenTony-p4f,giựt tít tào lao chưa xong mã
buồn,f9hb2ovj4Tk,@vandaitran183,chết là chuẩn 0
buồn,f9hb2ovj4Tk,@banthi9471,ăn nhiều tiền quá 3 28
buồn,f9hb2ovj4Tk,@banthi9471,ăn nhiều tiền qúá
buồn,f9hb2ovj4Tk,@minhpham8943,biết trước ăn rồi chết thì làm ăn nổi
buồn,f9hb2ovj4Tk,@honghoang4834,mày hại dân hại nước mày sẽ bị quả báo thôi thân vãn gì
buồn,f9hb2ovj4Tk,@honghoang4834,đọc tiểu thuyết à nhàm nhí
buồn,f9hb2ovj4Tk,@honghoang4834,nhàm quá rồi nói nhiều quanh quẩn
buồn,f9hb2ovj4Tk,@noithatgotunhiennguyenkhuo9170,tùm lưm
buồn,f9hb2ovj4Tk,@noithatgotunhiennguyenkhuo9170,bọn này nó lừa biết bao nhiêu người nhà tan của lát thập chi còn cũng theo vào tù luôn
buồn,f9hb2ovj4Tk,@thanhdinh1516,bởi vì bà không tin vào nhân quả bà cứ tưởng ăn trên đầu ngồi trên tróc người khác mà thoát được vậy tự pháp lấy việc đầu mà làm
buồn,f9hb2ovj4Tk,@SungSam-q4e9u,ơk chương trình hay qúá
buồn,f9hb2ovj4Tk,@TrangNguyen-cg9fj,tàổ lao pháo tầm bậy là mệt
buồn,f9hb2ovj4Tk,@BienNguyen-ss4wv,tôi nghĩ nếu bà trương mỹ lan khác phục được phần lớn hậu quả do mình gây ra thì pháp luật nên giảm án tử hình cho bà ta là tốt nhất
buồn,f9hb2ovj4Tk,@TAMNGUYEN-xo6gc,cũng vừa thôi tiền mà dùng như thế thì
buồn,f9hb2ovj4Tk,@lienghoangvan4226,lúc lợi dụng chức vụ quyền hạn tham ô tham nhũng hàng nghìn tỷ đồng thì chắc bà ta tha hồ hô mây gọi gió đi lại như một bóng ma coi dân đen như cỏ giác đúng trời cao cũng có mắt khi bị bắt và tòa phán quyết tử hình thì mới biết hối hận nhưng muộn rồi
buồn,f9hb2ovj4Tk,@HaiNguyen-gf3ow,tiền vàng chất chồng như núi không không ai đại gì giết tin vịt
buồn,f9hb2ovj4Tk,@tatan-n1b,ơan ức dự làm phải không ăn bao nhiêu ngân tỷ đóng mà còn oán úc dự vậy 2 30 2 32
buồn,f9hb2ovj4Tk,@TámĐào-t2s,cứ đổ hết tội trạng cho trương mỹ lan những người giúp sức cho bà lan mới cần xem xét nghiêm minh nếu không được giúp sức như vậy thì bà lan không thể phạm tội như vậy
buồn,f9hb2ovj4Tk,@PhaichauNeang-jh8ze,em hy vọng kiếp sau chỉ sống tốt kiếp này lở lần chức chị kiếp tốt hơn
buồn,f9hb2ovj4Tk,@PhươngXuân-o6h,có ngon cũng ăn không lổi
buồn,f9hb2ovj4Tk,@đắckỷ1975,khùng bả còn đang bị xử nhiều vụ nửa mà bửa cơm cúối cùng
buồn,f9hb2ovj4Tk,@HậuKhêHồng,xin thường niệm nam mô ngọc hoàng thượng đế vô cực đại thiên tôn nam mô anh di đà phật nam mô quán thế âm bồ tát nam mô cửu huyền thất tổ
buồn,f9hb2ovj4Tk,@Huong.Giang.Nguyen,chắc gì bà ta đã chết
buồn,f9hb2ovj4Tk,@ductrinh9745,khổ quá chết có mang theo được cái gì gì đù nhỏ đâu mà tham thế để bây giờ ân hận cũng không được nữa rồi
buồn,f9hb2ovj4Tk,@ductrinh9745,bà tham làm quá chứ còn sao
buồn,f9hb2ovj4Tk,@NguyenTam-hj2vc,sảo trá cở nào cũng bị trả giá mà thôi
buồn,f9hb2ovj4Tk,@atnguyenphu1407,tha mạng cho người ta tiền thì cũng lấy lại rồi tử hình cũng mang lại được gì không
buồn,f9hb2ovj4Tk,@4jjejrrJdjdjene,tơ an noises căn nội said sự thát
buồn,f9hb2ovj4Tk,@4jjejrrJdjdjene,tại số lucky thân ở không thần văn gỗ kêu ca cải girl
buồn,f9hb2ovj4Tk,@benguyen2632,tôi đồng ý ba tư hình những tới không cảm phút bơi ở phải sao vụ oán này còn có rất nhiều người tirp tây với bá tôi iều cầu phải cư osn tất cả nhìng có liền hoàn với ba bơi gì có máy người này tiếp tây mới say ra có sử này hội chính quyền việt nam ôi có sử công bằng không vay tới móng rằng pháp luật sẽ có tỉnh lý cho ba sng để làm lại còn nếu như sự bà iần từ thị hay lại những người tiếp tây với ba như mới du rằng để cho những cần bộ có quyền hạnh trong viết tiếp tây với ba lan thanks
buồn,f9hb2ovj4Tk,@uchiennguyen5671,bà không ngủ được có nhớ đến ông hải người đã chống lưng bà để bà có được sự tột đỉnh vinh quang mộ thời
buồn,f9hb2ovj4Tk,@xuanphucvu4107,nhiều tiền để làm gì chết có mang đi được đâu hối hận đã muộn rồi
buồn,f9hb2ovj4Tk,@TinhLê-v9j,ăn nhiều puá phải bé bụng thơi
buồn,f9hb2ovj4Tk,@KhanhNguyen-qi4hq,toàn chuyện tào lao vớ vẩn nói bậy bạ pa chỉ khố
buồn,f9hb2ovj4Tk,@thivannguyen1534,quá ghê tởm cải luật
buồn,f9hb2ovj4Tk,@Battu-578,nếu bà này không có gốc gác trung quốc thì chưa chắc đã tử hình
buồn,f9hb2ovj4Tk,@20Joane,millions businesses in vietnam máy bé 90 of them just same as văn thuận phát she just one of millions there
buồn,f9hb2ovj4Tk,@coachbaoanh6205,nói dối kênh này thiêú sự chính trực vì tiền mà sẵn sàng bịa chuyện nên xem lại để được lâu dài các em nhé
buồn,f9hb2ovj4Tk,@trungduong5065,bà không na n nạ y đa cươ p đòa t bao nhiêu tiê n ba chị cư anh mô i ngươ i đê n nay cũ người không khă chị phú chị tổ á anh n thị hư anh hệ n trả tiê n là i cho chủ người tôi nhưng chơ mà i chă người thâ y hô i âm thâ t là đău lô người
buồn,f9hb2ovj4Tk,@ThuTran-uy5if,kênh này rất liên thiên
buồn,f9hb2ovj4Tk,@PhuongNguyen-qj1ve,pháp luật giỏi thì tìm ra kẻ trùm đứng sau đi
buồn,f9hb2ovj4Tk,@PhuongNguyen-qj1ve,cứ y án là quá đúng
buồn,f9hb2ovj4Tk,@thuytiennguyen2112,việt nam đúng là luật rừng ở với vợ chồng mà không biết nó là ai
buồn,f9hb2ovj4Tk,@khanhdao8857,chúc chị ra đi thành thản
buồn,f9hb2ovj4Tk,@huynhlong9880,đã tử hình đâu mà cuối cùng câu lại vớ vần
buồn,f9hb2ovj4Tk,@tiennguyen-sw2dt,khai mẹ nó hết ra chắc không ăn một mình ấu
buồn,f9hb2ovj4Tk,@vinhnguyen2813,biết cái chết sự sống chọn cái nào mà vẫn làm như mà túy họ có sợ đâu
buồn,f9hb2ovj4Tk,@vinhnguyen2813,đọa dẫm thôi rồi ít nhiều cũng có trả lại 1 ít mà giảm án chết là hết xóa ai đúng ai sái
buồn,f9hb2ovj4Tk,@ViênMongThi-p3k,lợi đụng chức quận tượng là ăn tham không ai biết nhưng người ta cho ăn nó rồi mới biết là đắng cây nhỉ bà loạn ạ
buồn,f9hb2ovj4Tk,@LyChi-ms6kh,lấy tiền của dânmua hai cái giỏ bằng dân nghèo nhịn cả đời ác thật
buồn,f9hb2ovj4Tk,@TungXuan-j3d,kg nói vào trọng tảm
buồn,f9hb2ovj4Tk,@thiminhle9741,kênh này không trung thực tính hoa đâu không thấy xạo xạo không
buồn,f9hb2ovj4Tk,@ChuonBan-o6n,thăm tiền nhiều làm gì cho khổ cái thân chết là hết có đem theo được đâu
buồn,f9hb2ovj4Tk,@HungThai-bd8st,biết trước mà vẫn làm kg có gì an hận
buồn,f9hb2ovj4Tk,@HuePham-wf5og,thăm thì thâm hậu quả tụ chũi thôi
buồn,f9hb2ovj4Tk,@PhatPhapVoBienVN,năm mô anh đi đà phật nguyên thị hằng còn xin bổ tát phụ họ còn về quê bình an còn niệm nam mô anh đi đà phật
buồn,f9hb2ovj4Tk,@nguoiviettaiailoan7351,kênh tao lao
buồn,f9hb2ovj4Tk,@trietlytinhhoa,tiết lộ lời trăn trối cuối cùng của trương mỹ lan trước khi lãnh án t ử triết lý tinh hoa
buồn,f9hb2ovj4Tk,@mikenguyen909,tàổ lao nói thì hay lắm lấy like thì cũng phải có logíc chứ
buồn,f9hb2ovj4Tk,@VũHuỳnh-y1i,theo tôi là không nêntử hình việt nam có một ở 2
buồn,f9hb2ovj4Tk,@jokernguyen6175,đừng dẫn dắt dư luận nghiệp báo cũng lãnh đủ đấy triết lý nhân sinh gì ở đây
buồn,f9hb2ovj4Tk,@ThuNguyen-bx3od,tàổ lao tứ đế trương mỹ lan đã được trắng án về nhà rồi chứ có bị giết đâu
buồn,f9hb2ovj4Tk,@HoangAnh-kv3kr,bữa cơm đau
buồn,f9hb2ovj4Tk,@VŨHUNG-k9e,cầu cho mọi người luôn bình an
buồn,f9hb2ovj4Tk,@sentran6781,ok chương trình rất hay người nói có giống nói qua hay và làm cho người nghe nhiều xúc dong
buồn,f9hb2ovj4Tk,@tuvo2191,ước gì không ai bị tử hình
buồn,f9hb2ovj4Tk,@LýNguyễnThị-c8w,ngày cũng chỉ an hai bữa cơm sao mà lại ngũ thế nhỉ không biết đu
buồn,f9hb2ovj4Tk,@tuanlam7151,hại biết bao người chết chưa hết tội
buồn,f9hb2ovj4Tk,@ThiệnNguyễn-p5d,năm mô anh đi đà phật nhân quả không chưa một ai
buồn,f9hb2ovj4Tk,@SỹHồngHồ-f6d,nghệ chỉ miếng tôi phẩm miếng phát tâm xa
buồn,f9hb2ovj4Tk,@duongtriy5572,kẻ nào cũng thế khi sống đạp lên trên tất cả dẫm đập lên người dân đau khổ khi lĩnh án thì kể nể công lao kể hoàn cảnh không nghe kẻ bất lương sám hối
buồn,f9hb2ovj4Tk,@ThúyTrươngThị-l2r,chết như thế nào thì cũng là chết muon van cái chết mà chết là hết song tốt cũng chết song tôi tu cũng là chết nhg chết mà để lại cho con cái rất rất nhiều nhiều tỷ thì cũng đáng chết còn tôi chết chả để lại cho con cái gì tốt để làm gì khi chết chỉ có hai bàn tay trắng
buồn,f9hb2ovj4Tk,@TuấnQuốc-c4s,kênh này luôn nói tâm bây biết rõ thì nói không biết thì im lặng nói bậy để câu lấy ạ
buồn,f9hb2ovj4Tk,@anhlinh6831,triết lý tính hoa mà ra thông tin như ăn cướp
buồn,f9hb2ovj4Tk,@HienNguyen-wx7zi,nhiều tiền để làm gì
buồn,f9hb2ovj4Tk,@HangNguyen-kw8gy,còn mọt còn sâu làm sao phải đau sót ăn cho lắm đục khoét cho nhiều kẻ làm suy tàn kinh tế của nhà nước tội này tử hình là đúng phải như thế mới làm gương cho những kẻ muốn làm sâu mọt muốn đục khoét tiền của tài sản của nhà nước việt nam
buồn,f9hb2ovj4Tk,@ongnha6555,năm mô anh đi đà phật nam mô anh đi đà phật nam mô anh đi đà phật
buồn,f9hb2ovj4Tk,@nutran997,lòng tham không đáy dẫn dắt cho hành động biết bao người gia đình đã khổ vì lòng tham của bà
