emotion,video_id,author,comment
ngạc nhiên,6--MeBmIea8,@newuocspt61,hài hước thẹc kkk chỉ tội con cá lóc cũng bị quoánh ghen chung kkk t phát hiện qua điện thoại khi nghe tiếng phụ nữ léo nhéo ở đầu dây bên kia t chỉ hỏi ai đang nói chuyện ở đầu dây bên kia vậy thằng chồg cũ cứg họng ngắc ngứ như mắc xươg cá trong miệg không nói được câu nào vì bị bắt cái thóp xuyên qua điện thoại 1 tuần sau hắn vẫn chứg cũ nhậu say khướt trong lúc chở t đi côg việc hắn mượn cớ đợi lâu chửi rủa tùm lum ngoài đườg t không nói gì vì đang tham gia giao thông cần im lặng giữ bình tĩnh để bảo vệ bản thân mình về đến nhà hắn đi nhậu tiếp t âm thầm cuốn gói từng thứ một tỉ mỉ từ từ cẩn thận không sót 1 món đồ nào và luôn cả 2 đứa con gái còn nhỏ đứa đang học lớp 5 đứa đang học lớp 1 1 cái bầu đứa con trai út vừa đi siêu âm về hôm qua luôn về nhà mẹ ruột cũng may lấy chồg cùng trong tp của mình vì hắn đi nhậu không về nhà tối hôm đó nên t có dư thời gian di chuyển tất cả mua ổ khóa mới khóa nhà luôn để căn nhà trống trơn sạch sẽ còn thuê người đến dọn vệ sinh tẩy uế cho sạch rồi mới khóa cửa cho 2 đứa nhỏ về nhà ngoại trước sau đó dọn đồ thuê xe thuê người hàng xóm hỏi t nói dọn đồ chuyển đi ở trọ tạm thời để chuẩn bị sửa nhà mọi người cũng biết thằng cha cũ hay đi nhậu nhẹt bỏ bê vợ con nên cũng phụ giúp bưg bê chút đỉnh chứ không nói gì nhiều vì thấy bà bầu dọn nhà 1 mình họ cũng thương xong xuôi mua ổ khóa mới khóa xịn khóa nhà luôn cho chắc mọi thứ xong sạch sẽ t về nhà mẹ ngủ 1 giấc ngon lành cùng các con yêu thương của t biết ơn mẹ vì luôn để dành cho con gái 1 pòng riêng khi về thăm nhà mặc dù căn nhà của gia đình cũng chẳg rộng rãi gì biết ơn mẹ luôn bao dug che chở mẹ con của con con biết ơn mẹ em trai rất nhiều đã luôn giag rộng vòg tay hỗ trợ con 3 kids sáng mai hắn gọi điện nói anh đang ở nhà nội của mấy đứa nhỏ em lên tính toán tiền bạc làm ăn rồi chở anh về nhà với trong lúc xe máy là hắn đang đi t lên nhà mẹ đẻ hắn bằng kiểu gì có bầu pải đi xe ôm lên nhà mẹ đẻ hắn để chở hắn về hả trời lúc đó cười đ nổi luôn t hít thở thật sâu bình tĩnh trong khi tim vẫn đập loạn xạ nói chúng ta ly hôn đi dừng mọi chuyện tại đây t không pải là con sen đặc biệt của anh gia đình anh tôi cho thuê nhà để lấy tiền nuôi con nên anh ở nhà nội luôn đi t đơn phươg li hôn không cần anh ký giấy trời ơi hắn chửi um sùm tao lấy con khác sợ gì mày vui vẻ t cười ruồi nói chúc mừg anh đã có được mấy con ngoại cảnh ngoại càng dưới địa phủ lên để ưa anh hắn nói tao giữ hết tiền làm ăn không đưa lại mày đồng nào luôn tiền của t bốc bát biêu đưa hắn làm ăn t cười nếu anh muốn như vậy cúp máy luôn đ cần gặp mặt ngoài đời luôn chịu đựg 13 năm trong 1 cuộc hôn nhân tồi tệ thế là đủ lắm rồi kết thúc 2011 nhà của gia đình t cho hắn đ có cửa đòi chia hắn ôm số tiền làm ăn đi luôn đến giờ t nhờ luật sư đơn phương li hôn lí do ngoại tình có đoạn ghi âm trong máy điện thoại con gái đầu của t lúc đó học lớp 5 còn hỏi cô là ai mà nghe điện thoại của ba cháu đi sinh cậu con trai út 1 mình có em gái kết nghĩa giúp đỡ có mẹ ruột cùng em trai hỗ trợ mọi chuyện cũng qua tôi ôm luôn 3 đứa con nuôi đến khôn lớn sau 4 năm tôi gặp anh người mỹ anh ấy không có con cái gì rất yêu quý 3 đứa con của tôi anh ấy cưới tôi nuôi 3 đứa con của tôi như con ruột của mình biết ơn anh dave còn hắn vẫn vậy già nhân ngãi non vợ chồng với 1 cô thị nở xinh đẹp dại khờ chịu đựg sự say xỉn khùg điên của hắn thậm chí còn bị hắn đánh đập hắn lúc còn sống với t không dám đánh t vì gia đình t có luật sư bộ đội côg an bp đầy đủ hắn cô thị nở xinh đẹp dại khờ kia không sinh đẻ đứa con nào với nhau cổ đã có 1 con trai riêng hằg thág 2 đứa con gái đi taxi lên nhà nội gặp hắn để đòi tiền lãi từ tiền hắn ôm của tôi đi theo cô bồ nhí chiếc xe máy lúc đó hắn cũng lấy luôn có lúc hắn trả có lúc không trả còn tiền cấp dưỡg cho 3 đứa con thì hắn không đưa 1 xu nào hoàn toàn t mẹ t nuôi 3 đứa con đến khi t gặp dave thì anh ấy nuôi phụ thêm nhìn lại bây giờ 2024 thấy mọi chuyện đã đi qua tự hỏi sao mà mình có nghị lực mạnh mẽ đến vậy bây giờ kể lại chỉ để cười cho vui chứ hòii đó khóc thầm nào ai hay biết biết ơn về tất cả
ngạc nhiên,6--MeBmIea8,@Yourcilp,ăn trước rồi tính
ngạc nhiên,6--MeBmIea8,@TrangTrang-v4e,tôi muốn bể bụng
ngạc nhiên,6--MeBmIea8,@luomnguyenvan3436,vụ này ở xóm túi nè hài lắm
ngạc nhiên,6--MeBmIea8,@anhtruongtu4431,còn cá lóc t không làm gì mà cũng lời t vô
ngạc nhiên,6--MeBmIea8,@ThanhluyếnTẩn,bà tiểu tâm bự ú nu
ngạc nhiên,6--MeBmIea8,@dautayzuize609,rước nhỏ vợ bé về ở chúng nhà cho rồigu mặn
ngạc nhiên,6--MeBmIea8,@LiemPham-r6k,cười muôn bễ bụng luôn á
ngạc nhiên,6--MeBmIea8,@TinPhuong-uo4dn,máy ông mấy bà sao mà hầm lấy nhau bậy bạ vậy không có não à lấy vậy hành diện đử chưa mấy mẹ việt nam và dùng sĩ anh hùng laj luôn
ngạc nhiên,6--MeBmIea8,@BBP1980PC,mình là người miền bắc nghệ mấy em nói mà mình không biết là đang nói gì chẳng hiểu bảo đánh gen mà nhìn như đang vui cười trò truyện việc gì đó
ngạc nhiên,6--MeBmIea8,@LongThan-o2q,thằng cha đó cũng bà lắm
ngạc nhiên,6--MeBmIea8,@PhaiTay-d1r,thực ra ngày xưa ông công ông táo mà mọi người hay thờ cúng cũng là 2 ông yêu 1 bà có sao đâu cứ quận trọng hóa vấn đề lên
ngạc nhiên,6--MeBmIea8,@LiemPham-r6k,cười muôn bễ bụng luôn
ngạc nhiên,6--MeBmIea8,@danen896,khổ thân còn cá lóc đến chết cũng không được yên thân
ngạc nhiên,6--MeBmIea8,@bathuoc_36g5,nhấp cá lóc hả
ngạc nhiên,6--MeBmIea8,@bondka6014,đứa 4 bịch sữa đứa không bịch nào
ngạc nhiên,6--MeBmIea8,@_Farce,tiểu tâm trông có vẻ mỡ màng
ngạc nhiên,6--MeBmIea8,@anhhoananh7836,mình có đánh ngên là đánh luôn 2nguội nhà tại 2nguồi qua lợi mới vậy
ngạc nhiên,6--MeBmIea8,@thutieu4537,cá lóc sad tạo có làm gì đâu
ngạc nhiên,6--MeBmIea8,@HangKhach-nu7ck,bưồn cười
ngạc nhiên,6--MeBmIea8,@kethienduyen.0511,video này thật sự đã truyền tải nhiều giá trị ý nghĩa cảm ơn tác giả vì thông điệp nhân văn
ngạc nhiên,6--MeBmIea8,@aimioan5944,ủa còn cá lốc ngơ ngác ngỡ ngàng bật ngửa túi có biết gì âu kk
ngạc nhiên,6--MeBmIea8,@ducvankhuu5691,bà ta nói câu gì mà mắc cười nhỉ
ngạc nhiên,6--MeBmIea8,@NhoiKa-pn5ml,cá lóc tổ lắm chị
ngạc nhiên,6--MeBmIea8,@truongle9155,có lê mở n cả lọc la môn khoái khẩu ông chọng
ngạc nhiên,6--MeBmIea8,@lequocthang86,tôi đang coi tính 3phút mà vừa ngồi ăn cơm nghệ một cái tôi cười sặt cơm luôn
ngạc nhiên,6--MeBmIea8,@duyenduyen7595,chị đi đa nh ghen mà chị còn máu hài trong ngươ i nư anh
ngạc nhiên,6--MeBmIea8,@KhoaKienThuc,đi đánh ghen không quên tấu hài
ngạc nhiên,6--MeBmIea8,@JulieTu-y2o,phụ nữ ở dưới cũng giống nhau ở trên cũng vậy chỉ khác trái tìm và cái đầu vậy mà mấy cha ngoại tình chắc do thích sugar mấy bà vợ bà mẹ ở nhà vừa cơm nước giặt giũ vừa chợ búa nấu nướng vừa còn cái học hành rồi áp lực cưộc sống nói không nên lời làm gì mà sugar nổi mấy cha hiểu đùm còn cho đở
ngạc nhiên,6--MeBmIea8,@honghuynh-s3q,người nội còn cả lộc nói gì không nghệ rô
ngạc nhiên,6--MeBmIea8,@thsjha1139,chỗ tôi có một ông cũng lén phén với 1 bà nhưng người vợ bình tĩnh không chửi bới không cần đánh ghen bà vợ chỉ tới ngồi nói với bà kia 1 câu chồng chị lén phén thì kệ lương chị lấy hết con nào ngu thì cứ đưa cho chồng chị chơi miễn phí khỏi phải đi chơi đỉ tốn tiền rồi từ đó bà kia bỏ luôn
ngạc nhiên,6--MeBmIea8,@NghiaNguyenuc-lr6hz,cùng việt nam nhưng nghe giọng cách nói người khác vùng miền thì nó hơi khó nghe
ngạc nhiên,6--MeBmIea8,@SuaTra-rk7bg,trà xanh tuy già nhưng điện nước đầy đủ
ngạc nhiên,6--MeBmIea8,@Mientayquetoi08,cá lóc túi tội gì trời
ngạc nhiên,6--MeBmIea8,@giauphan34355,bô mê thă người đò cho rô i chỉ ơi em thâ y thương 2 còn chỉ thôi chư ngươ i ti nh giá mà chồng chỉ có n phá i nư anh thị thừa ô ị
ngạc nhiên,6--MeBmIea8,@nhathieungo2489,còn cá lóc vô tội mừ
ngạc nhiên,6--MeBmIea8,@vinhtranvan8197,đi đánh ghen nhưng không trú tâm vào việc chính
ngạc nhiên,6--MeBmIea8,@hanhbuithi1391,cameramen xinh thê
ngạc nhiên,6--MeBmIea8,@thienphuc9470,những thằng mê gái thì tốt nhất là lý đị nếu thả thứ cho nó lần này thì suốt đời đời đi đáng ghen tiếp thôi
ngạc nhiên,6--MeBmIea8,@thienbao9748,đánh ghen bẩn tay khi người chồng hoặc vợ sống qua biết điều mà bi phản bội thì đánh ghen cho bẩn tay tiễn vong
ngạc nhiên,6--MeBmIea8,@TuấnNguyễn-u9j7z,gì vậy trời túi đảng sắp lên thớt còn bị chửi lây nữa
ngạc nhiên,6--MeBmIea8,@HaiVi-n2d,đem thăng chông va con tiêu tam ra nga ba đương côt vai gôc cây cho moi ngươi va dong ho 2 bên hanh diên vi con minh luc nao cung tôt
ngạc nhiên,8p48LX_LbSY,@huongthanthi3688,sao không làm thêm xe phòng ăn riêng nối vàô
ngạc nhiên,8p48LX_LbSY,@huongthanthi3688,có thịt chó không
ngạc nhiên,8p48LX_LbSY,@andanh2443,nếu thực sự mà nấu được đúng chuẩn theo công thức của từng vùng miền việt nam thì thì sẽ tăng giá trị ẩm thực việt cao hơn nhưng điều này sẽ khó xảy ra bởi ẩm thực việt nêm nấu khẩu vị từng vùng miền rất khác nhau nên lấy một điểm chung thì không thể người miền này nấu đúng chuẩn món ăn của vùng miền khác lại càng không thể vậy thì tạm tạm xem xem mà thôi vậy nên để người ăn tự nhận xét ngon dở người nấu và người đưa tin đừng tự tâng bốc mình quá nha
ngạc nhiên,8p48LX_LbSY,@vannhunhu6944,nước ngoài hay nước ngoày hỡi tiếng việt
ngạc nhiên,8p48LX_LbSY,@meovietnam,người việt mình thật tuyệt vời
ngạc nhiên,8p48LX_LbSY,@maky9999,danh sách tổng kết ẩm thực việt nằm ở top 22 thái lan nó 17 trung quốc top 5 đó nhất là italia món việt ngon mà chắc không hợp gu mấy ông đánh giá không nên gáy nữa admin ơi
ngạc nhiên,8p48LX_LbSY,@yenhoang1463,u là trời tôi đang ở việt nam nhưng nhìn những món ăn mang hương vị việt vẫn thèm nè tụ hào ẩm thực việt
ngạc nhiên,8p48LX_LbSY,@ÂNTăng-i9c,đồ việt nam nên nhân rộng khắp thế giới
ngạc nhiên,8p48LX_LbSY,@tanta3391,tốt nhất thị phải cho bột ngót vào vì cá lưỡi mọi đa quyền vị đỏ rồi nếu không thì mát khách đầy
ngạc nhiên,8p48LX_LbSY,@tanta3391,môn an phải cơ thịt cho thị mới là đặc sản pp phải có đội cho nữa
ngạc nhiên,k8xNmc2Ay5s,@hongvannguyen2395,bảo tử của bạn chính là hạnh phúc sức khỏe của bạn đấy nhé có ăn uống đầy đủ mới vực được đạo sức khỏe là tài sản lớn nhất của loài người chúng sảnh yêu thương yêu thương yêu thương
ngạc nhiên,k8xNmc2Ay5s,@lanngocnguyen6836,việt nam có vô vàn món ăn với 100 đô thì thấm thía gì
ngạc nhiên,k8xNmc2Ay5s,@ninhbinhdream3923,quá đỉnh
ngạc nhiên,k8xNmc2Ay5s,@Tangplus20k,đúng là 100 ăn được rất nhiều món nhưng đôi khi mua quả đừa 5 hơặc 1 chuyến xích lô là hết luôn 100 nạn này khó mà khắc phục hẳn được cũng vì vậy mà người nước ngoài mới quá việt nam thường được nhắc nên đi mua đồ cùng 1 người việt nam
ngạc nhiên,k8xNmc2Ay5s,@LamTran-rq8qu,10 đô là cho món xoài dầm ở hà nội bữồn cho nạn chặt chém ở ngay chính thủ đô nước mình
ngạc nhiên,k8xNmc2Ay5s,@dovanhinhdovan7043,em chưa thủ món bún cho nghiện luôn hệ hệ
ngạc nhiên,k8xNmc2Ay5s,@haihoangnguyen3247,ngày xưa chứ bữa này mắc lắm
ngạc nhiên,k8xNmc2Ay5s,@minhsangpham6186,comment 4 ne
ngạc nhiên,k8xNmc2Ay5s,@hocnguyentri5699,chuẩn luôn nhà các bạn nước ngoài muốn ẩm thực việt nam chúc các bạn nước ngơài ngon miệng khi dự lịch ở việt nam
ngạc nhiên,k8xNmc2Ay5s,@longle7057,măm măm
ngạc nhiên,P6JC3NoOADY,@nacngon,cà phê việt nam nổi tiếng nhờ hương vị và giá thành bánh mì nổi tiếng ở mấy kênh youtube bốc phét ảo tưởng về sự nổi tiếng của nó không tin bạn cứ hỏi một người nước ngoài ở đất nước của họ
ngạc nhiên,P6JC3NoOADY,@locle7955,thị ch ăn ba nh flan lă m nhưng ăn nhiê u thị nghệ ở mâ t
ngạc nhiên,P6JC3NoOADY,@huanphan4978,thèm quá admin làm thêm món tiramisu phiên bản việt đi
ngạc nhiên,P6JC3NoOADY,@NgocAnh-yh3wy,huhu nhìn mà thèm
ngạc nhiên,P6JC3NoOADY,@thungoc720,hãỷ cho việt nam một món ăn họ sẽ biến tấu nó thành một sự riêng biệt
ngạc nhiên,P6JC3NoOADY,@mihthien4937,cả 2 tháng nay ở nhà 24 24 không được ăn bánh mì không được ăn phở hủ tiếu cơm tấm bún riêu khóc á
ngạc nhiên,P6JC3NoOADY,@MinhNguyen-tq2qi,bất ngờ chưa
ngạc nhiên,P6JC3NoOADY,@tutran-fd8yx,8 17 cái này là bánh lăng phải không
ngạc nhiên,P6JC3NoOADY,@khongxacinh6911,tôi tưởng bánh mì của nước việt nam mình là bản gốc
ngạc nhiên,P6JC3NoOADY,@vanngocvu4321,tưi tưởng bánh flan làm bằng đường thăng hơi vừa rồi đổ lên chứ chưa thấy đổ cafe
ngạc nhiên,P6JC3NoOADY,@lyha1066,ýa ưa bánh bông lan là của việt à giờ mới biết
ngạc nhiên,P6JC3NoOADY,@sonicjohn6493,the m qua đi sa người ra đi ti m mới đươ chị hĩi
ngạc nhiên,P6JC3NoOADY,@20luzer52,perfect examples of when students become better thân their teacher
ngạc nhiên,P6JC3NoOADY,@blackShot113,từ những thứ xa xỉ thượng lưu của nước ngoài khi mang vào việt nam đều bị cho đơn giản hóa để phục vụ lại cho thường dân một phần phải cảm ơn người pháp
ngạc nhiên,P6JC3NoOADY,@TrungPham-oj6mx,bánh mì việt nam có phải làm từ việt nam
ngạc nhiên,P6JC3NoOADY,@NguyenHoangVN1991,đồ gì của pháp cũng ăn được mỗi cái caramen của nó không nuốt nổi các bợn ạ nó béo không ăn đx
ngạc nhiên,P6JC3NoOADY,@ninhnguyenthi1707,chàổ svietnam
ngạc nhiên,P6JC3NoOADY,@camnhungao1379,bánh mì kẹp nem chua rán nộm đu đủ bao ngon
ngạc nhiên,P6JC3NoOADY,@minhnhatnguyen9111,người việt nam luôn biết giữ lại những gì tính hoa nhất mà thực dân để lại nên việt nam không bao giờ bị đồng hóa việt nam vẫn mãi mãi là việt nam vẫn giữ gìn được bản sắc của dân tộc mình
ngạc nhiên,P6JC3NoOADY,@kocotenau7808,nhiều người xem mà ít like thế thôi không sao em vẫn luôn ủng hộ ađ
ngạc nhiên,P6JC3NoOADY,@AnAn-te5op,có một món bánh mì mà chưa chắc mấy ông tây ăn và nghệ ra thì vô cùng tuổi thơ đó là món bánh mì thịt khó hột lụ một món ăn vừa rẻ vừa ngon mà không phải ai cũng có địp nếm đâu nà uwu
ngạc nhiên,P6JC3NoOADY,@baothanh5363,caffe là nhất
ngạc nhiên,P6JC3NoOADY,@ig1601,xem đầu tiên
ngạc nhiên,lOgxwBX-32I,@tarottraitao7223,mối quan hệ tình cảm mập mờ crush người yêu cũ người yêu mới công việc sự nghiệp liên hệ zalo vui lòng nhắn tin 0777 868 358 tụ 1 0 44tụ 2 8 14tụ 3 15 51
ngạc nhiên,lOgxwBX-32I,@LeQuangBinh-wu8dr,cảm ơn em em vui tính ha
ngạc nhiên,lOgxwBX-32I,@BathongChu-j8r,mình chọn tụ 1
ngạc nhiên,lOgxwBX-32I,@NguyenHuyen-r6c,cảm ơn táo nhiều ngê
ngạc nhiên,lOgxwBX-32I,@NhưQuỳnh-l9e,em chọn tụ 2 cảm ơn chị nhiều lắm nhà
ngạc nhiên,lOgxwBX-32I,@kimphuong967,mình chọn t2 thanks táo
ngạc nhiên,lOgxwBX-32I,@Trần-e8x,cám ổn bạn nhè
ngạc nhiên,lOgxwBX-32I,@dunglonglongnguyen2246,cám ổn tạo tả rớt minh nghệ tin bắt nghò thực sự biệt
ngạc nhiên,lOgxwBX-32I,@nhipham2309,cảm ơn chị táo rất nhiều chẳng biết là ai
ngạc nhiên,lOgxwBX-32I,@onbinhminh805,chàổ táo thân yêu
ngạc nhiên,lOgxwBX-32I,@KhanhNguyen-yc4gu,tụ 2 cảm ơn táo
ngạc nhiên,lOgxwBX-32I,@明月阮-v9m,ngơn lành nhà
ngạc nhiên,lOgxwBX-32I,@미-j4d,tủ2 cảm ơn chị
sợ hãi,VqMAHaea5zo,@hoathuy194,anh từ kiểu
sợ hãi,VqMAHaea5zo,@ngocnguyen-f2m5n,lần nào coi mấy cái quý tắc nhà nhiều người bên cạnh main là túi cứ nghĩ chớt hết đám trừ main ra mấy nhân vật thông minh như trần ngôn từ thường chết ngay phút cuối không
sợ hãi,VqMAHaea5zo,@MaiYeuVietNaM.,cố nhân cứ mãi biệt lý
sợ hãi,VqMAHaea5zo,@DanhNguyencong-ni8ny,rồi ai là nv9 vậy
sợ hãi,VqMAHaea5zo,@huongcandy848,trần ngôn từ vốn là chủ thể của thế giới này cậu ta đã trải qua hơn 80 lần vòng tuần hoàn lặp lại của trò chơi cánh cửa phía sau trường đúng là lối thoát nhưng thổát xong vẫn chớt trần ngôn từ rất quý trọng 2 người bạn của mình cho nên chỉ có thể chọn cách tự xóa bỏ bản thân cũng khiến thế giới quý tắc bị phá bỏ lúc này hai người bạn mới thoát được huhu kết buồn qúá
sợ hãi,VqMAHaea5zo,@_levuongtueanhtruongththuc195,tội nghiệp trần ngôn từ
sợ hãi,VqMAHaea5zo,@Tenginek,11 23 tình cảm qúá
sợ hãi,VqMAHaea5zo,@Junniynek,huhu t khóc ê
sợ hãi,VqMAHaea5zo,@tranhau6342,doàn cuội sùv đông quá
sợ hãi,VqMAHaea5zo,@tranhau6342,hãy ghe
sợ hãi,VqMAHaea5zo,@_levuongtueanhtruongththuc195,tội nghiệp trần ngôn từ
sợ hãi,VqMAHaea5zo,@giangphan2323,noob_refund
sợ hãi,VqMAHaea5zo,@Ruok999-u6,ăi mua account không
sợ hãi,VqMAHaea5zo,@nozerofour,chào mừng các diễn viên đến với trường học dành cho ông già noel xin hãy tuân thủ những quy tắc sau đây 1 ký túc xá không có ma nếu có hãy tổ chức lễ hội 20 ngày để đuổi ma đi 2 khi đi ra khỏi ký túc xá phải đi trên trần nhà để không chạm vào mặt đất 3 khi gặp giáo viên màu đỏ hay nhảy samba cách mặt đất 1000 mét và từ từ rơi xuống 4 khi gặp bạn học đeo khẩu trang màu đen hãy nhảy điệu nhảy samba và đi trên trần nhà để đuổi bọn họ đi 5 không được ăn ở căng tin nếu ăn sẽ không bị làm sao
sợ hãi,VqMAHaea5zo,@nokiaapa9291,quy tắc không có chủ thể sẽ không còn tác đụng gì mà khi ngôn từ ôm giáo viên đồ đỏ đi cùng thì thế giới quý tắc lập tức biến mất vậy thì ngôn từ là chủ thể của quý tắc hoặc cô áo đỏ mà trong 1 năm ngôn từ trải qua 80 lần vòng lặp khúc cuối bảo đám bạn chắc chắn sẽ sống sót v thì những vòng lặp trước ngôn từ luôn luôn là người sống sót duy nhất và có thể là người chơi duy nhất nhưng đám bạn đù là người chơi ảo nhưng mà vẫn quyết tâm cứu ngôn từ nên sau khi đám bạn thật cũng bị dính vào thế giới quý tắc ngôn từ mới liều mạng cứu giúp
sợ hãi,VqMAHaea5zo,@Domdom_yesyes,13 27 vậy được luôn h
sợ hãi,VqMAHaea5zo,@manbat6987,giáo viên múp thế
sợ hãi,VqMAHaea5zo,@MissGrace_1,vãi đi học vào lúc 8 giờ tối
sợ hãi,VqMAHaea5zo,@Emma_n0te,trọi ỏi gấu ra nhìu video waada yêu gấu
sợ hãi,VqMAHaea5zo,@Mónđồchơi_YoonGaram,anh ơi sau này nếu được anh làm về nội đúng kinh đị gây cấn đuy anh
sợ hãi,VqMAHaea5zo,@MunXLongdown,phim hay quá trần ngôn từ suy luận hãy xem mà không nghĩ tới luôn
sợ hãi,VqMAHaea5zo,@QuynhNguyen-cb5co,lão trần đẹp zai qa
sợ hãi,VqMAHaea5zo,@Haru-sama1206,hãy quá anh ơi vwv
sợ hãi,VqMAHaea5zo,@KhanhVanLeNgoc-th3iy,là sao
sợ hãi,VqMAHaea5zo,@KhanhVanLeNgoc-th3iy,sao đàng hay mà buồn quá vậy
sợ hãi,VqMAHaea5zo,@Kira_kpop0912,tr oi cuối buồn v gấú
sợ hãi,VqMAHaea5zo,@Moneysexual2122,khúc cuối buồn vãi ò
sợ hãi,VqMAHaea5zo,@ngochungnguyen2618,nói thật thì t cứ ngỡ trần ngôn từ là main người gì đâu vừa đẹp trai còn suy luận gỏi gánh hết hai đứa bạn qua bao ải
sợ hãi,VqMAHaea5zo,@TranPhamAnhThu-zj2zb,coi gấu hoài mà nhận ra chưa đăng ký
sợ hãi,VqMAHaea5zo,@chientham-zt5rm,đúng là hay ghê
sợ hãi,VqMAHaea5zo,@istplove,hãy mà coii buồn quaaaa ạ
sợ hãi,VqMAHaea5zo,@NganTran-vy1ns,ỏ gấu này ra liên tù tì 2 viđ hơn nửa tiếng luôn yêu ghia
sợ hãi,VqMAHaea5zo,@Mun_art2k13,đắng sớm v anh tối làm tiếp đóaaa
sợ hãi,VqMAHaea5zo,@Kienrblx,fân nè
sợ hãi,VqMAHaea5zo,@chungtranvan4983,quá hày
sợ hãi,VqMAHaea5zo,@rinnenhu2276,má buồn v má
sợ hãi,VqMAHaea5zo,@TruongChiVudepzai3,trần ngôn từ đọc tiểu thuyết nhiều quá nên lúc vào thế giới quý tắc kì lạ vẫn bình tĩnh suy nghĩ mặc đù ổng bị lặp lại
sợ hãi,VqMAHaea5zo,@tuanquoc6993,1 ngày 1 video được không gấú
sợ hãi,VqMAHaea5zo,@channanZin,thích mất cái video quy tắc này
sợ hãi,VqMAHaea5zo,@Lingggg-264,hãy ghê
sợ hãi,VqMAHaea5zo,@Thaoneek,khúc cuối buồn thật sự
sợ hãi,VqMAHaea5zo,@tructruc5555,côi anh lâu rồi mà nhìn lại thì thấy chưa đăng kí v
sợ hãi,VqMAHaea5zo,@hieunguyenba8689,hỉ admin nhé fan mới nè nhìn thấy admin ra cái là bay vào xem lùn í
sợ hãi,VqMAHaea5zo,@KamiTV-r8d,chậm 19phút
sợ hãi,VqMAHaea5zo,@thuydungnguyen7147,chậm 14 phút
sợ hãi,VqMAHaea5zo,@HaiNguyen-is3xv,hello anh
sợ hãi,VqMAHaea5zo,@chibi-fox-chan,tin nhắn 1 phút trước
sợ hãi,Al4pKKbM1tk,@GauSoHaiTV,xem phim vui vẻ nhé các bạn
sợ hãi,Al4pKKbM1tk,@KhanKhan-z4e5l,hòá ra main với thằng tiểu lan mới là những đứa bị kẹt lại
sợ hãi,Al4pKKbM1tk,@CakCu-v5h,bạn hãy làm nhiều video kiểu này tôi sẽ ủng hộ
sợ hãi,Al4pKKbM1tk,@LongTrần-h4m,phim hay vãi
sợ hãi,Al4pKKbM1tk,@đoànhuy-r5h,ưồi hay thế ra phần 2 đê
sợ hãi,Al4pKKbM1tk,@mikey6619,hấp dẫn
sợ hãi,Al4pKKbM1tk,@QuyVy.,phim hay xem bưổi tối mới hày
sợ hãi,Al4pKKbM1tk,@aAbcd-g5w,hãy quá
sợ hãi,Al4pKKbM1tk,@Hung_gioinamnobede,bà cô giáo ở phòng trực cực mở to mắt há mồm rồi đứng afk
sợ hãi,Al4pKKbM1tk,@Hung_gioinamnobede,cô giáo ở phòng trực be like
sợ hãi,Al4pKKbM1tk,@SuSuper-qr5vs,kết buồn quá ạ
sợ hãi,Al4pKKbM1tk,@ducthanh-z2z,cái này là truyện những quy tắc quái dị của vân đạm phong khuynh nè này là phần 1 quy tắc ở trưởng học số 8
sợ hãi,Al4pKKbM1tk,@What-t2x,hayyyyyyyyyy qué điiiiiiiiiii
sợ hãi,Al4pKKbM1tk,@What-t2x,hayyyyyy qué điiiiiiiii
sợ hãi,Al4pKKbM1tk,@What-t2x,hayyyyyy qué điiiiiiiii
sợ hãi,Al4pKKbM1tk,@mutam-hv1gp,phim sài quá nhiều nãô
sợ hãi,Al4pKKbM1tk,@thachhuynh1283,hãy quá y như trong phím
sợ hãi,Al4pKKbM1tk,@Zotrimotchut,hiểu rồi 3 người anh em 16 17 18 ánh giữa 17 chết anh cạnh số 17 là 16 cười người anh cạnh anh giữa thấy không vui liền giết anh số 16 và số 18 là số xe bus sống sót
sợ hãi,Al4pKKbM1tk,@ThanhNguyen-ts7ip,thg này nguuuu vờ cờ lờ 26 57
sợ hãi,Al4pKKbM1tk,@MạnhNguyễn-t4n,phim của bạn càng xem càng cuốn
sợ hãi,Al4pKKbM1tk,@Thitran9107-z8v,phim hay qua nên tặng cho cái đăng kí
sợ hãi,Al4pKKbM1tk,@taydoan8468,cho tôi ảnh đầu giường kí túc xá
sợ hãi,Al4pKKbM1tk,@Mlinhchi,40 06 mày đã thích thầm tao 3 năm trước đúng không 40 43 tao thích cái giáng vẻ m khinh tao thật quyến rũ video hay mong ra tiếp
sợ hãi,Al4pKKbM1tk,@hanris-hzn,t thích dáng vẻ của m khinh t rất quyến rũ
sợ hãi,Al4pKKbM1tk,@lantotv8819,ơk có ai gây không
